Address,Areas_Served,Awards,Background_img,Category,City,Company_Description,Company_Name,Company_Website,Company_link,Job_Cost,License_number,Number_of_Reviews,Number_of_stars,Phone2,Phone_Number,Profile_img,Services_provided
"New York,, New York 10038,United States","Borough of Bronx, Manhattan, New York, Queens, West New York, Staten Island, Brooklyn, Los Angeles, Miami, Miami Beach, Southern California",,https://st.hzcdn.com/simgs/10724a4c0cd98f5e_17-3060/home-design.jpg,Architects and Building Designers,New York USA,"Plainspace Architecture + Design dpc

Plainspace Architecture + Design was founded in 2001 in New York City by Angelica M. Ruano. The original premise was to provide Architectural, Interior and Design services with a high level of direct personal involvement and collaboration for and with each client. Every project is undertaken as an individual pursuit toward a simple and clear design solution appropriate for the particular client, scope and context. No two projects are the same. Our work is an exploration of the interplay between Architecture and materials and the continuing tradition of simplicity and practicality in design both visually and philosophically.

To us a project encompasses much more than a meaningful design. It is a complex process involving many challenges and decisions which we carefully define and navigate our clients through. Over the years we have expanded the scope offering to include Project Management and Owner representation services to provide services which offer more control and clarity throughout the project process.

Plainspace Architecture and Design was joined by Marc Albertin in January of 2007. We have a total of eight staff combined in New York and Florence, Italy and are licensed Architects in the states of New York, California, Texas, Florida, Arizona, and Nevada. Our body of work spans a range of scales as well as geography with projects across the United States to Dubai.",PLAINSPACE Architecture + Design dpc,http://plainspacedesign.net,https://www.houzz.com/professionals/architects-and-building-designers/plainspace-architecture-design-dpc-pfvwus-pf~2015071079,"$300,000 - 25 million",,,,(917) 250-4221,(646) 916-4836,https://st.hzcdn.com/fimgs/23e37ec80cd9869f_9647-w181-h181-b0-p0--.jpg,"3D Rendering, Architectural Design, Architectural Drawings, Bathroom Design, Building Design, Custom Home, Earthquake Retrofitting, Floor Plans, Home Additions, Home Extensions, Home Remodeling, House Plans, Kitchen Design, Kitchen Remodeling, New Home Construction, Project Management, Space Planning, Universal Design"
"Julie Schuster,11 Riverside Drive, Ste. 5SW,New York,, New York 10023,United States","Bayonne, Borough of Bronx, Cliffside Park, Clifton, East Rutherford, Eastchester, Edgewater, Elmwood Park, Fort Lee, Ft Lee, Garfield, Harrison, Hoboken, Inwood, Jersey City, Lyndhurst, Mount Vernon, New York, North Arlington, Palisades Park, Rutherford, Saddle Brook, Teaneck, Union City, Weehawken, West New York, Yonkers, Englewood, Manhattan","NKBA (National Kitchan and Bath Association) VP Manhattan Board 
CLIPP (Certified Living In Place Professional) Creating Safe Accessible Design for all ages and abilities Ambassador and featured speaker
 IFSG (International Feng Shui Guild), Red Ribbon Professional Feng Shui Practitioner",https://st.hzcdn.com/simgs/5ff20d14042ed18d_17-3621/home-design.jpg,Interior Designers and Decorators,New York USA,"New York City Premier Interior Designer Best of Houzz 2015 - 2019
We are a wellness interior design firm specializing in Living in Place design (creating safe and accessible design for all ages and abilities), and Feng Shui applications used to create spaces that nurture and support the people that live in them.
Our projects range from decorating to full scale remodels for our clients.  An experienced practitioner who is able to solve problems and avoid costly mistakes, regardless of the size of the project we take pride in our work and follow it every step along the way.  Our services include;  Complete Residential Interior Design Services, Living In Place Design,  Kitchen and Bath Design, Technology Integration, Space Planning and Storage Management Solutions, New Construction Planning, Remodeling and Project Management, Lighting Design, Custom Furniture Design, Color Palette Creation, ""Green"" and Sustainable Solutions Consulting.
We also currently work with several major real estate concerns on staging homes for sale in all boroughs of Manhattan and Queens, as well.  Our projects regularly sell over the asking price, quickly and in bidding wars.
From initial consultation to the final finishing touches, Julie has the training and experience to manage all aspects and details of the project.

PUBLISHED:
Contributing writer with KBB Magazine (Kitchen and Bath Business)
EDITOR AT LARGE: ""Designer Julie Schuster on the art and science of feng shui"" 
 <a rel=""nofollow"" target=""_blank"" href=""https://editoratlarge.com/articles/5353/designer-julie-schuster-on-the-art-and-science-of-feng-shui"">https://editoratlarge.com/articles/5353/designer-julie-schuster-on-the-art-and-science-of-feng-shui</a>
International Feng Shui Guild Interviews Julie Schuster --> <a rel=""nofollow"" target=""_blank"" href=""http://media.wix.com/ugd/8afd77_1a9c39067ff64682babd25a72a4f047f.pdf"">http://media.wix.com/ugd/8afd77_1a9c39067ff64682babd25a72a4f047f.pdf</a>
Ambassador with:
Living In Place Institute
Robern cabinetry
Mr Steam",Julie Schuster Design Studio,http://jlsdesignstudio.com,https://www.houzz.com/professionals/interior-designers-and-decorators/julie-schuster-design-studio-pfvwus-pf~1099359599,"$4,000 - 100,000,Not everyone needs or can afford a complete remodel.  I love to help clients with just shopping for the perfect small changes as well as a complete change!  Once we have worked together, you'll come back for more!",,19 Reviews,Average rating: 5 out of 5 stars,(646) 295-0018,(646) 295-0018,https://st.hzcdn.com/fimgs/7aa3a34201c8ab55_4315-w181-h181-b0-p0--.jpg,"Bathroom Design, Bedroom Design, Closet Design, Color Consulting, Dining Room Design, Downsizing, Feng Shui Design, Floor Plans, Furniture Selection, Handicap-Accessible Design, Holiday Decorating, Home Office Design, Home Staging, Interior Design, Kitchen Design, Living Room Design, Project Management, Universal Design"
"New York,, New York,United States",New York,,https://st.hzcdn.com/simgs/eb31a2740c26b885_9-7135/home-design.jpg,Window Contractors,New York USA,"We know that in order to set ourselves apart from our competition, we have to take a bold approach to solve the growing technical and environmental demands of the future. We will accomplish this through different or more effective products that will be readily available to market.

Our goal is to meet our customers’ needs by developing constantly new solutions for the challenges created by the always changing demands of our society. Building the best window, door & façade systems is and always will be our passion.

We take Quality Assurance serious. We are using each component of our window systems with a mindset to give our customers the best available product on the market. We selected high quality European standard window systems made here in the USA.",Solubon Ltd,http://www.solubon.com/,https://www.houzz.com/professionals/window-sales-and-installation/solubon-ltd-pfvwus-pf~2050157246,,,,,(347) 533-3271,(347) 923-6897,https://st.hzcdn.com/fimgs/afd3be0f0c26b8af_1520-w181-h181-b0-p0--.jpg,"Custom Windows, Exterior Shutters, Window Installation, Window Replacement"
"Valentin Oflidis,Manhattan,, New York 10001,United States","Hoboken, Jersey City, New York City, New Jersey, Connecticut",,https://st.hzcdn.com/simgs/3f5273e906a7b1e6_17-2916/home-design.jpg,Ironworkers,New York USA,"O Studio likes to push the limits and make new creations that have never been done before. We have no boundaries when taking on new metal projects! O Studio creates pieces that keep functionality with the unique appeal of being hand-made coupled with the visual effects of today’s technology. O Studio's art pieces are sold in our NYC Manhattan and Brooklyn studios, boutique stores, and even to collectors from coast to coast. 

O Studio transforms its work to the fusion of structure, color, and rigidity of metal. The result is art that functionally merges an abstraction of the 20th century with innovations of 21st century.","O Studio, Inc.",http://www.ostudiometal.com,https://www.houzz.com/professionals/ironwork/o-studio-inc-pfvwus-pf~345849013,"$5,000 - 100,000",DCA # 2079208,15 Reviews,Average rating: 5 out of 5 stars,(877) 222-1116,(646) 762-5250,https://st.hzcdn.com/fimgs/ac739ba70692ebab_1171-w181-h181-b0-p0--.jpg,"Metal Fabrication, Steel Fabrication, Welding, High end custom fine metalwork and hand forged, Design, Fabrication, Restoration., Products: Gates,Fences, Furniture, Materials : Cold/Hot Rolled Steel, wrought iron, wood , stone , glass., Finishes: blackened steel patina, Historical restorations, custom steel & glass partitions, French windows, barn doors, steel & glass room divider, steel & glass walk in closet, steel & glass loft room wall, steel & glass wine cellar partitions, European steel & glass wall, office steel & glass partitions"
"Mimi Sason,102 Orchard Street,New York City,, New York 10002,United States","Manhattan, New York, Bronx, Jamaica, Rego Park, QUEENS, BROOKLYN, NEW JERSEY, LONG ISLAND, NEW YORK METRO AREA",,https://st.hzcdn.com/simgs/e1023588073cf0fb_17-4475/home-design.jpg,Furniture Repair & Upholstery Services,New York USA,"Joe's Fabrics has the largest selection of top quality upholstery and drapery fabrics in NYC.  And if we don't have what you're looking for in stock we'll order it for you.

Our custom made department, headed by Mimi Sason, is well respected by the best designers in the industry. Our team of upholsterers and installers provide everything from slipcovers to motorized drapes. We look forward to adding you to our generations of satisfied customers.

Come visit our showroom! We'd love to work with you!
102 Orchard Street New York, NY 10002 (212) 674-7089",Joe's Fabrics,http://joesfabrics.com/,https://www.houzz.com/professionals/upholstery/joes-fabrics-pfvwus-pf~722000234,$3000.00 - AND UP,,2 Reviews,Average rating: 5 out of 5 stars,(212) 674-7089,(646) 783-1213,https://st.hzcdn.com/fimgs/0083c343073cf297_2057-w181-h181-b0-p0--.jpg,"Custom Drapery, Custom Furniture, Custom Upholstery, Wall Upholstery, UPHOLSTERY, WINDOW TREATMENTS, SHADES, DRAPERY, REUPHOLSTERY, FABRICS"
"Ronnie Safdie,1402 Lexington Ave,New York,, New York 10128,United States","New York, Manhattan, Brooklyn, Queens, Bronx","NKBA, ASID, BBB, NYC EPA/ LEAD Certified
Best of Houzz 2016-2018",https://st.hzcdn.com/simgs/6282e0ef05ba514b_17-0170/home-design.jpg,Design-Build Firms,New York USA,"At Berceli, it’s about the attention to detail and getting the renovation done right.

Our unique process ensures that we finish projects on-time, on-budget and to our clients’ satisfaction. Our goal is to help you define and transform your space into that ""dream space"" within a realistic budget. Constant communication, from the start of the project to the last finishing touches, keep you in control of the entire design and renovation process.

At the initial consultation we gain insight into the nature and scope of the project by discussing factors such as design motifs, themes, materials to be used, timeline and the general budgetary parameters. During this phase all selected components come together with floor plans, wall elevations and a 3-dimensional image to assist the client in visualizing the actual space. Revisions are prepared if necessary. Full-color artist renderings and product samples are available if necessary. Finishing elements such as door styles, hardware, counter top materials, appliances, plumbing fixtures, stone vs. tile layouts, and glass enclosures are all incorporated into the design. A modest retainer is required at this stage. Once the project is accepted and approved, a contract that includes the pricing, detailed project description and finalized design plans is prepared and signed. The product delivery is scheduled and we coordinate with our in-house design consultants, project managers and licensed installers to execute the renovation and installation. 

At Berceli, we are committed to getting the job done right. Upon completion of each project we take the time necessary to ensure complete customer satisfaction and will make any finishing touches necessary. At Berceli, we guarantee our integrity, attention to detail, and the ability to meet and exceed our clients’ expectations. 

Give us a call, let’s talk possibilities!",Berceli,http://www.berceli.com,https://www.houzz.com/professionals/design-build-firms/berceli-pfvwus-pf~251792024,"$20,000 - 700,000",,16 Reviews,Average rating: 5 out of 5 stars,(212) 722-8811,(646) 291-2613,https://st.hzcdn.com/fimgs/dfb338870086c103_5720-w181-h181-b0-p0--.jpg,"Bathroom Design, Floor Plans, Home Remodeling, Kitchen Design, Kitchen Remodeling, Project Management, Space Planning, Design Build Firm, Kitchen and Bath Showroom, General Contracting, Specializing in Complete Interior Remodeling, Architectural Design & Drawings, Kitchen Design and Remodeling, Construction Drawings, Interior Design, Kitchen & Bathroom Remodeling, Kitchen & Bathroom Design, Kitchen Cabinets, Custom Cabinetry."
"Zee Akber,1349 Second Ave.,New York,, New York 10021,United States","Astoria, Manhattan, New York, Brooklyn","NKBA, BBB
Best of Houzz 2014, 2015, 2016, 2017, 2018 & 2019 Service Award",https://st.hzcdn.com/simgs/3432a96a0422b04a_17-2984/home-design.jpg,Cabinetry and Cabinet Makers,New York USA,"MANHATTAN CABINETS Inc is a premier kitchen cabinetry showroom located at 1349  2nd Avenue (Corner of 71st Street and 2nd Ave). We have been a fixture in the community for many years, providing discerning customers with the very best in quality and design services. In addition to the best selection of custom and semi-custom cabinets in the city, MANHATTAN CABINETS also offers premium design and full service construction services. 

MANHATTAN CABINETS Inc. is an authorized dealer of Omega and KraftMaid cabinetry, one of the world’s largest cabinetry distributor and we display a full line of The KraftMaid product line in our 2nd Avenue showroom.

MANHATTAN CABINETS can turn your humdrum apartment into a fully functional living space with the finest selection of appliances, cabinets, lighting and flooring. From concept to completion, MANHATTAN CABINETS is your single source.

MANHATTAN CABINETS is poised to assist you by providing professional design services as well as quality and affordable cabinetry. We will work side by side with you so that you can realize the vision you have for your kitchen and bathroom cabinet needs. When you are thinking of a new kitchen we encourage you to speak to as many kitchen professionals as you wish to gain as much insight as possible, before you make your final decision we ask that you give MANHATTAN CABINETS a call. We believe that after consulting with us you will see the difference that a trusted, established business with a proven track record can make.

Our company is affiliated with the National Kitchen and Bath Association and in good standing with the Better Business Bureau.",Manhattan Cabinets Inc,http://www.manhattancabinets.com,https://www.houzz.com/professionals/cabinets-and-cabinetry/manhattan-cabinets-inc-pfvwus-pf~914367236,"$15,000 - 500,000",,102 Reviews,Average rating: 5 out of 5 stars,(212) 548-2436,(212) 548-2436,https://st.hzcdn.com/fimgs/222364990f69dad1_8645-w181-h181-b1-p0--.jpg,"Cabinet Sales, Custom Bathroom Vanities, Custom Bookcases, Custom Built-ins, Custom Cabinet Doors, Custom Cabinets, Custom Entertainment Centers, Custom Home Bars, Custom Kitchen Cabinets, Custom Pantries, Custom Storage, Pantry Design"
"FireDean Schilling,Brooklyn,, New York 11211,United States","Long Island City, New York, Brooklyn, Greenwich, New Milford, Bronxville, park slope, boerum hill, carroll gardens, williamsburg, greenpoint, fort greene, brooklyn heights, crown heights, bed stuy, cobble hill, red hook, ditmas park, Red Hook, Dutchess County, Hudson Valley, Stanfordville, Millbrook, Clinton Corners, Rhinebeck, Rhinecliff, Kingston, Germantown, Hudson, Milan","2007-2008 Block judge - For Brooklyn Botanic Garden
http://www.bbg.org/news/judging_greenest_block_video
1st Prize Washington Home & Garden Show
Featured Profile in The New York Post:
http://nypost.com/2014/06/10/vertical-gardens-add-a-green-touch-to-luxe-nyc-miami-spots/",https://st.hzcdn.com/simgs/dcd2e66904f52ee3_17-6444/home-design.jpg,Landscape Architects and Designers,New York USA,"Landscape Design + Build  -Exteriors & Interiors

First, we are evangelical about beauty. We believe beauty informs function, not the other way around. And beauty is more than just something to look at. It dictates success, and behavior.  Ever notice how people behave better in a beautiful setting?  We study how it works too. We think YOU know a little ...because you've taught us what compels people to enter a space. We continue to learn and ask questions...ie - How does it beckon us this way or that? 

Second, our clients are our life blood. I often complain I have too many keys but the truth is those keys represent TRUST. We build long term relationships with the majority of our clients. 
Our work only actually works when you are 100% pleased with the result.",The Brooklyn Garden Club,http://thebrooklyngardenclub.com,https://www.houzz.com/professionals/landscape-architects-and-landscape-designers/the-brooklyn-garden-club-pfvwus-pf~1451803728,"$10,000 - 500,000,Our one hour on site consultation includes rough cost estimates and is free of charge. Please call us to schedule.",46-4553390,15 Reviews,Average rating: 5 out of 5 stars,(917) 239-8644,(917) 239-8644,https://st.hzcdn.com/fimgs/eb5318e404f5291d_8688-w181-h181-b0-p0--.jpg,"3D Rendering, Barn Design & Construction, Custom Water Features, Deck Design, Drought Tolerant Landscaping, Edible Gardens, Garden Design, Gazebo Design & Construction, Green Roofing, Hardscaping, Landscape Design, Landscape Plans, Living Walls, Organic Gardens, Outdoor Lighting Design, Patio Design, Pond Construction, Pool Landscaping, Rooftop Deck Installation, Site Planning, Deck Building, Trellis Construction, Drip Irrigation Installation, Irrigation System Installation, Landscape Lighting Installation, Outdoor Lighting Installation, Patio Construction, Pergola Construction, Planting, Retaining Wall Construction, Site Preparation, Sprinkler System Installation, Stump Grinding, Stump Removal, Tree Planting, Tree Pruning, Tree Removal, Fieldstone Wall Construction"
"Paula McDonald,27 W 20th Street, 7th Floor, Suite 706,New York,, New York 10011,United States",Manhattan,"2017, 2012, 2009 Qualified Remodeler/Master Design Award
2017, 2014 Chrysalis Award
2014 Professional Remodeler Design Award
2013 NYC&G Interior Design Award",https://st.hzcdn.com/simgs/33b27a620579f4a2_17-9126/home-design.jpg,Design-Build Firms,New York USA,"Our one stop shop approach to Renovations in Manhattan: a full service design, build and interiors firm with a broad range of expertise from concept to completion. This includes design, architectural plans and filing, expediting, sourcing, supply and building from modern to traditional -- we are committed to excellence in every aspect of your project!!

COST FACTORS AS OF 2019. Based on recent bids on our projects, to achieve results similar to those seen in our portfolio, your “hard cost” construction budget (labor and materials) would realistically need to be in the $350+/sf range for the finished building only, exclusive of landscaping, furniture, and soft costs (plans and permits).",Paula McDonald Design Build & Interiors,http://www.pmddllc.com,https://www.houzz.com/professionals/design-build-firms/paula-mcdonald-design-build-and-interiors-pfvwus-pf~436809710,"$250,000 - 2 million,COST FACTORS AS OF 2019. Based on recent bids on our projects, to achieve results similar to those seen in our portfolio, your “hard cost” construction budget (labor and materials) would realistically need to be in the $350+/sf range for the finished building only, exclusive of landscaping, furniture, and soft costs (plans and permits).",GC#605030,36 Reviews,Average rating: 5 out of 5 stars,(212) 633-0594,(212) 633-0594,https://st.hzcdn.com/fimgs/0723eca201f7e47c_2633-w181-h181-b0-p0--.jpg,"Bathroom Design, Bathroom Remodeling, Building Design, Custom Homes, Demolition, Floor Plans, Flooring Installation, Green Building, Home Remodeling, House Plans, Kitchen Design, Kitchen Remodeling, Lighting Design, Lighting Installation, Site Planning, Site Preparation, Space Planning, Sunroom Design & Construction, Construction Drawings, Custom Cabinets, Window Installation, Gut Renovations, Interior Design"
"Victoria Mendal,New York,, New York 10021,United States",New York,,https://st.hzcdn.com/simgs/964266dd0942bdf5_17-6539/home-design.jpg,Interior Designers and Decorators,New York USA,"Victoria Mendal Interior Design is a small independent design firm, offering a full range of both residential and commercial design services. With over 16 years of design experience, and projects in Curacao, Bermuda, Venezuela, Miami, New York, Toronto, and the North East, Victoria Mendal offers numerous ways to redesign and customize your space based on the budget, your needs and functionality of the space.

Design of interior space, requires addressing flooring, wall and ceiling options, electrical requirements and lighting needs based on the clients individual style. And to harmonize it with the endless options of furniture and furnishings to create a unique environment for each space, incorporating the elements of timelessness, balance and proper proportion.

We work on all different scales of projects.

From living rooms, to kitchens, from basements to attics, from restaurants to doctor’s offices, Victoria Mendal Interior Design will work closely with you offering professional and personalized service.",Victoria Mendal Interior Design,http://victoriamendaldesign.com/,https://www.houzz.com/professionals/interior-designers-and-decorators/victoria-mendal-interior-design-pfvwus-pf~1764137395,"$25,000 - 1.5 million",,8 Reviews,Average rating: 5 out of 5 stars,(201) 543-9667,(862) 225-6227,https://st.hzcdn.com/fimgs/d6f3957c0942be43_3198-w181-h181-b0-p0--.jpg,"Art Selection, Basement Design, Bathroom Design, Bedroom Design, Closet Design, Color Consulting, Custom Bathroom Vanities, Custom Blinds & Shades, Custom Bookcases, Custom Built-ins, Custom Cabinets, Custom Entertainment Centers, Custom Fireplace Mantels, Custom Furniture, Custom Home Bars, Custom Kitchen Cabinets, Custom Murphy Beds, Custom Pantries, Custom Rugs, Custom Shelving, Custom Walk-in Closets, Decluttering, Dining Room Design, Downsizing, Entry Design, Floor Plans, Furniture Selection, Holiday Decorating, Home Office Design, Home Staging, Home Theater Design, House Plans, Interior Design, Kids Bedroom Design, Kitchen Design, Laundry Room Design, Lighting Design, Living Room Design, Mudroom Design, Nursery Design, Playroom Design, Space Planning, Sunroom Design & Construction, Universal Design, Wine Cellar Design, Kitchen Remodeling, Interior Redesign"
